{
  "schema": "skenion.graph",
  "schemaVersion": "0.0.0",
  "id": "minimal",
  "revision": "rev_0001",
  "nodes": [
    {
      "id": "time_1",
      "kind": "time",
      "params": {},
      "inputs": [],
      "outputs": [
        {
          "id": "seconds",
          "label": "Seconds",
          "type": {
            "flow": "sampled",
            "kind": "time",
            "unit": "seconds"
          }
        },
        {
          "id": "bang",
          "label": "Frame Bang",
          "type": {
            "flow": "event",
            "kind": "bang"
          }
        }
      ]
    },
    {
      "id": "value_1",
      "kind": "value",
      "params": {
        "value": 1
      },
      "inputs": [],
      "outputs": [
        {
          "id": "out",
          "label": "Value",
          "type": {
            "flow": "constant",
            "kind": "number.float64"
          }
        }
      ]
    }
  ],
  "edges": []
}
